{
  "$schema": "http://json-schema.org/draft-04/schema#",
  "$ref": "#/definitions/object_02",
  "definitions": {
    "object_01": {
      "type": "object",
      "required": [
        "@type",
        "title",
        "accessLevel",
        "accrualPeriodicity",
        "contactPoint",
        "describedBy",
        "describedByType",
        "description",
        "identifier",
        "issued",
        "keyword",
        "landingPage",
        "modified",
        "publisher",
        "distribution",
        "bureauCode",
        "programCode",
        "theme"
      ],
      "additionalProperties": false,
      "properties": {
        "@type": {
          "type": "string"
        },
        "title": {
          "type": "string"
        },
        "accessLevel": {
          "type": "string"
        },
        "accrualPeriodicity": {
          "type": "string"
        },
        "contactPoint": {
          "title": "contactPoint",
          "type": "object",
          "required": [
            "@type",
            "fn",
            "hasEmail"
          ],
          "additionalProperties": false,
          "properties": {
            "@type": {
              "type": "string"
            },
            "fn": {
              "type": "string"
            },
            "hasEmail": {
              "type": "string"
            }
          }
        },
        "describedBy": {
          "type": "string"
        },
        "describedByType": {
          "type": "string"
        },
        "description": {
          "type": "string"
        },
        "identifier": {
          "type": "string"
        },
        "issued": {
          "type": "string"
        },
        "keyword": {
          "$ref": "#/definitions/array_01"
        },
        "landingPage": {
          "type": "string"
        },
        "modified": {
          "type": "string"
        },
        "publisher": {
          "title": "publisher",
          "type": "object",
          "required": [
            "@type",
            "name"
          ],
          "additionalProperties": false,
          "properties": {
            "@type": {
              "type": "string"
            },
            "name": {
              "type": "string"
            }
          }
        },
        "distribution": {
          "type": "array",
          "title": "distribution",
          "items": {
            "type": "object",
            "required": [
              "@type",
              "downloadURL",
              "mediaType",
              "format",
              "title",
              "describedBy",
              "describedByType"
            ],
            "additionalProperties": false,
            "properties": {
              "@type": {
                "type": "string"
              },
              "downloadURL": {
                "type": "string"
              },
              "mediaType": {
                "type": "string"
              },
              "format": {
                "type": "string"
              },
              "title": {
                "type": "string"
              },
              "describedBy": {
                "type": "string"
              },
              "describedByType": {
                "type": "string"
              }
            }
          }
        },
        "bureauCode": {
          "type": "array",
          "items": {
            "type": "string"
          }
        },
        "programCode": {
          "type": "array",
          "items": {
            "type": "string"
          }
        },
        "theme": {
          "type": "array",
          "items": {
            "type": "string"
          }
        }
      }
    },
    "object_02": {
      "description": "JSON Schema generated by XMLSpy v2016 (http://www.altova.com)",
      "type": "object",
      "required": [
        "conformsTo",
        "describedBy",
        "@context",
        "@type",
        "dataset"
      ],
      "additionalProperties": false,
      "properties": {
        "conformsTo": {
          "type": "string"
        },
        "describedBy": {
          "type": "string"
        },
        "@context": {
          "type": "string"
        },
        "@type": {
          "type": "string"
        },
        "dataset": {
          "type": "array",
          "title": "dataset",
          "items": {
            "$ref": "#/definitions/object_01"
          }
        }
      }
    },
    "array_01": {
      "type": "array",
      "title": "keyword",
      "description": "tuple type",
      "additionalItems": false,
      "minItems": 6,
      "maxItems": 6,
      "items": [
        {
          "type": "string"
        },
        {
          "type": "string"
        },
        {
          "type": "string"
        },
        {
          "type": "string"
        },
        {
          "type": "string"
        },
        {
          "type": "string"
        }
      ]
    }
  }
}