{
	"conformsTo": "https://project-open-data.cio.gov/v1.1/schema",
	"describedBy": "https://project-open-data.cio.gov/v1.1/schema/catalog.json",
	"@context": "https://project-open-data.cio.gov/v1.1/schema/catalog.jsonld",
	"@type": "dcat:Catalog",
	"dataset": [
		{
			"@type": "dcat:Dataset",
			"title": "NEH evaluators, 1970-present",
			"accessLevel": "public",
			"accrualPeriodicity": "R/P1M",
			"contactPoint": {
				"@type": "vcard:Contact",
				"fn": "Peter Losin",
				"hasEmail": "mailto:plosin@neh.gov"
			},
			"describedBy": "http://www.neh.gov/open/data/NEH_EvaluatorsDictionary.pdf",
			"describedByType": "application/pdf",
			"description": "NEH peer-review evaluators, 1970-present",
			"identifier": "evaluators",
			"issued": "2015-02-20",
			"keyword": [
				"culture", "history", "humanities", "languages", "literature", "philosophy"
			],
			"landingPage": "http://www.neh.gov/open/data",
			"modified": "2015-02-20",
			"publisher": {
				"@type": "org:Organization",
				"name": "NEH"
			},
			"distribution": [
				{
					"@type": "dcat:Distribution",
					"downloadURL": "http://www.neh.gov/open/data/NEH_Evaluators.zip",
					"mediaType": "application/x-7z-compressed",
					"format": "xml",
					"title": "NEH evaluators",
					"describedBy": "http://www.neh.gov/open/data/NEH_EvaluatorsDictionary.pdf",
					"describedByType": "application/pdf"
				}
			],
			"bureauCode": [
				"418:00"
			],
			"programCode": [
				"010:000"
			],
			"theme": [
				"humanities grants"
			]
		}, {
			"@type": "dcat:Dataset",
			"title": "NEH grant data, 1970-1979",
			"accessLevel": "public",
			"accrualPeriodicity": "R/P1M",
			"contactPoint": {
				"@type": "vcard:Contact",
				"fn": "Peter Losin",
				"hasEmail": "mailto:plosin@neh.gov"
			},
			"describedBy": "http://www.neh.gov/open/data/NEH_GrantsDictionary.pdf",
			"describedByType": "application/pdf",
			"description": "Grants made by NEH, fiscal years 1970-1979",
			"identifier": "Grants-1970s",
			"issued": "2015-02-20",
			"keyword": [
				"culture", "history", "humanities", "journal literature", "languages", "philosophy"
			],
			"landingPage": "http://www.neh.gov/open/data",
			"modified": "2015-02-20",
			"publisher": {
				"@type": "org:Organization",
				"name": "NEH"
			},
			"distribution": [
				{
					"@type": "dcat:Distribution",
					"downloadURL": "http://www.neh.gov/open/data/NEH_Grants1970s.zip",
					"mediaType": "application/x-7z-compressed",
					"format": "xml",
					"title": "NEH grants, 1970-1979",
					"describedBy": "http://www.neh.gov/open/data/NEH_GrantsDictionary.pdf",
					"describedByType": "application/pdf"
				}
			],
			"bureauCode": [
				"418:00"
			],
			"programCode": [
				"010:000"
			],
			"theme": [
				"humanities grants"
			]
		}, {
			"@type": "dcat:Dataset",
			"title": "NEH grant data, 1980-1989",
			"accessLevel": "public",
			"accrualPeriodicity": "R/P1M",
			"contactPoint": {
				"@type": "vcard:Contact",
				"fn": "Peter Losin",
				"hasEmail": "mailto:plosin@neh.gov"
			},
			"describedBy": "http://www.neh.gov/open/data/NEH_GrantsDictionary.pdf",
			"describedByType": "application/pdf",
			"description": "Grants made by NEH, fiscal years 1980-1989",
			"identifier": "grants-1980s",
			"issued": "2015-02-20",
			"keyword": [
				"culture", "history", "humanities", "languages", "literature", "philosophy"
			],
			"landingPage": "http://www.neh.gov/open/data",
			"modified": "2015-02-20",
			"publisher": {
				"@type": "org:Organization",
				"name": "NEH"
			},
			"distribution": [
				{
					"@type": "dcat:Distribution",
					"downloadURL": "http://www.neh.gov/open/data/NEH_Grants1980s.zip",
					"mediaType": "application/x-7z-compressed",
					"format": "XML",
					"title": "NEH grants, 1980s",
					"describedBy": "http://www.neh.gov/open/data/NEH_GrantsDictionary.pdf",
					"describedByType": "application/pdf"
				}
			],
			"bureauCode": [
				"418:00"
			],
			"programCode": [
				"010:000"
			],
			"theme": [
				"humanities grants"
			]
		}, {
			"@type": "dcat:Dataset",
			"title": "NEH grant data, 1990-1999",
			"accessLevel": "public",
			"accrualPeriodicity": "R/P1M",
			"contactPoint": {
				"@type": "vcard:Contact",
				"fn": "Peter Losin",
				"hasEmail": "mailto:plosin@neh.gov"
			},
			"describedBy": "http://www.neh.gov/open/data/NEH_GrantsDictionary.pdf",
			"describedByType": "application/pdf",
			"description": "Grants made by NEH, fiscal years 1990-1999",
			"identifier": "grants-1990s",
			"issued": "2015-02-20",
			"keyword": [
				"culture", "history", "humanities", "languages", "literature", "philosophy"
			],
			"landingPage": "http://www.neh.gov/open/data",
			"modified": "2015-02-20",
			"publisher": {
				"@type": "org:Organization",
				"name": "NEH"
			},
			"distribution": [
				{
					"@type": "dcat:Distribution",
					"downloadURL": "http://www.neh.gov/open/data/NEH_Grants1990s.zip",
					"mediaType": "application/x-7z-compressed",
					"format": "XML",
					"title": "NEH grants, 1990s",
					"describedBy": "http://www.neh.gov/open/data/NEH_GrantsDictionary.pdf",
					"describedByType": "application/pdf"
				}
			],
			"bureauCode": [
				"418:00"
			],
			"programCode": [
				"010:000"
			],
			"theme": [
				"humanities grants"
			]
		}, {
			"@type": "dcat:Dataset",
			"title": "NEH grant data, 2000-2009",
			"accessLevel": "public",
			"accrualPeriodicity": "R/P1M",
			"contactPoint": {
				"@type": "vcard:Contact",
				"fn": "Peter Losin",
				"hasEmail": "mailto:plosin@neh.gov"
			},
			"describedBy": "http://www.neh.gov/open/data/NEH_GrantsDictionary.pdf",
			"describedByType": "application/pdf",
			"description": "Grants made by NEH, fiscal years 2000-2009",
			"identifier": "grants-2000s",
			"issued": "2015-02-20",
			"keyword": [
				"culture", "history", "humanities", "languages", "literature", "philosophy"
			],
			"landingPage": "http://www.neh.gov/open/data",
			"modified": "2015-02-20",
			"publisher": {
				"@type": "org:Organization",
				"name": "NEH"
			},
			"distribution": [
				{
					"@type": "dcat:Distribution",
					"downloadURL": "http://www.neh.gov/open/data/NEH_Grants2000s.zip",
					"mediaType": "application/x-7z-compressed",
					"format": "xml",
					"title": "NEH grants, 2000s",
					"describedBy": "http://www.neh.gov/open/data/NEH_GrantsDictionary.pdf",
					"describedByType": "application/pdf"
				}
			],
			"bureauCode": [
				"418:00"
			],
			"programCode": [
				"010:000"
			],
			"theme": [
				"humanities grants"
			]
		}, {
			"@type": "dcat:Dataset",
			"title": "NEH grant data, 2010-2019",
			"accessLevel": "public",
			"accrualPeriodicity": "R/P1M",
			"contactPoint": {
				"@type": "vcard:Contact",
				"fn": "Peter Losin",
				"hasEmail": "mailto:plosin@neh.gov"
			},
			"describedBy": "http://www.neh.gov/open/data/NEH_GrantsDictionary.pdf",
			"describedByType": "application/pdf",
			"description": "Grants made by NEH, fiscal years 2010-2019",
			"identifier": "grants-2010s",
			"issued": "2015-02-20",
			"keyword": [
				"culture", "history", "humanities", "languages", "literature", "philosophy"
			],
			"landingPage": "http://www.neh.gov/open/data",
			"modified": "2015-02-20",
			"publisher": {
				"@type": "org:Organization",
				"name": "NEH"
			},
			"distribution": [
				{
					"@type": "dcat:Distribution",
					"downloadURL": "http://www.neh.gov/open/data/NEH_Grants2010s.zip",
					"mediaType": "application/x-7z-compressed",
					"format": "xml",
					"title": "NEH grants, 2010s",
					"describedBy": "http://www.neh.gov/open/data/NEH_GrantsDictionary.pdf",
					"describedByType": "application/pdf"
				}
			],
			"bureauCode": [
				"418:00"
			],
			"programCode": [
				"010:000"
			],
			"theme": [
				"humanities grants"
			]
		}
	]
}